result_format: 4
drop table if exists t_s,t_p,t_p4,t_no_p,t_temp_s,t_temp_p,t_temp_p4,t_temp_p5;
explain_protocol: 0
create table t_s(c1 int primary key, c2 int ,c3 int);
create table t_p(c1 int primary key, c2 int ,c3 int) partition by hash(c1)  partitions 4;
create table t_p4(c1 int primary key, c2 int ,c3 int) partition by hash(c1)  partitions 4;
create table t_no_p(c1 int, c2 int ,c3 int) partition by hash(c1)  partitions 4;
create table t_temp_s(c1 int, c2 int, c3 int);
create table t_temp_p(c1 int, c2 int ,c3 int) partition by hash(c1)  partitions 4;
create table t_temp_p4(c1 int, c2 int ,c3 int) partition by hash(c1)  partitions 4;
create table t_temp_p5(c1 int, c2 int ,c3 int) partition by hash(c1)  partitions 5;

## delete测试
insert into t_s(c1,c2) values(1,1),(2,2),(3,3),(4,4),(5,5),(6,6),(7,7),(8,8),(9,9),(10,10);
call dbms_stats.gather_table_stats('test','t_s');
delete /*+use_px*/ from t_s;
select /*+blocking('all')*/ * from t_s order by c1;
+----+------+------+
| c1 | c2   | c3   |
+----+------+------+
+----+------+------+
insert into t_s(c1,c2) values(1,1),(2,2),(3,3),(4,4),(5,5),(6,6),(7,7),(8,8),(9,9),(10,10);
call dbms_stats.gather_table_stats('test','t_s');
delete /*+use_px, parallel(10)*/ from t_s;
select /*+blocking('all')*/ * from t_s order by c1;
+----+------+------+
| c1 | c2   | c3   |
+----+------+------+
+----+------+------+

insert into t_p(c1,c2) values(1,1),(2,2),(3,3),(4,4),(5,5),(6,6),(7,7),(8,8),(9,9),(10,10);
call dbms_stats.gather_table_stats('test','t_p');
delete /*+use_px,parallel(10)*/ from t_p;
select /*+blocking('all')*/ * from t_p order by c1;
+----+------+------+
| c1 | c2   | c3   |
+----+------+------+
+----+------+------+

insert into t_p(c1,c2) values(1,1),(2,2),(3,3),(4,4),(5,5),(6,6),(7,7),(8,8),(9,9),(10,10);
call dbms_stats.gather_table_stats('test','t_p');
delete /*+use_px,parallel(10)*/ from t_p where c1 >= 5;
select /*+blocking('all')*/ * from t_p order by c1;
+----+------+------+
| c1 | c2   | c3   |
+----+------+------+
|  1 |    1 | NULL |
|  2 |    2 | NULL |
|  3 |    3 | NULL |
|  4 |    4 | NULL |
+----+------+------+
delete from t_p;

insert into t_p(c1,c2) values(1,1),(2,2),(3,3),(4,4),(5,5),(6,6),(7,7),(8,8),(9,9),(10,10);
call dbms_stats.gather_table_stats('test','t_p');
delete /*+use_px,parallel(10)*/ from t_p where c1 = 5;
select /*+blocking('all')*/ * from t_p order by c1;
+----+------+------+
| c1 | c2   | c3   |
+----+------+------+
|  1 |    1 | NULL |
|  2 |    2 | NULL |
|  3 |    3 | NULL |
|  4 |    4 | NULL |
|  6 |    6 | NULL |
|  7 |    7 | NULL |
|  8 |    8 | NULL |
|  9 |    9 | NULL |
| 10 |   10 | NULL |
+----+------+------+
delete from t_p;

insert into t_p(c1,c2) values(1,1),(2,2),(3,3),(4,4),(5,5),(6,6),(7,7),(8,8),(9,9),(10,10);
insert into t_p4(c1,c2) values(1,1),(2,2),(3,3),(4,4),(5,5),(6,6),(7,7),(8,8),(9,9),(10,10);
call dbms_stats.gather_table_stats('test','t_p');
call dbms_stats.gather_table_stats('test','t_p4');
delete /*+use_px, parallel(10)*/ t_p from t_p,t_p4 where t_p.c1 = t_p4.c1 and t_p.c1 >= 5;
select /*+blocking('all')*/ * from t_p order by c1;
+----+------+------+
| c1 | c2   | c3   |
+----+------+------+
|  1 |    1 | NULL |
|  2 |    2 | NULL |
|  3 |    3 | NULL |
|  4 |    4 | NULL |
+----+------+------+
delete from t_p;

insert into t_p(c1,c2) values(1,1),(2,2),(3,3),(4,4),(5,5),(6,6),(7,7),(8,8),(9,9),(10,10);
call dbms_stats.gather_table_stats('test','t_p');
delete /*+use_px, parallel(10)*/ t_p from t_p,t_p4 where t_p.c1 = t_p4.c2 and t_p.c1 >= 5;
select /*+blocking('all')*/ * from t_p order by c1;
+----+------+------+
| c1 | c2   | c3   |
+----+------+------+
|  1 |    1 | NULL |
|  2 |    2 | NULL |
|  3 |    3 | NULL |
|  4 |    4 | NULL |
+----+------+------+
delete from t_p;

insert into t_p(c1,c2) values(1,1),(2,2),(3,3),(4,4),(5,5),(6,6),(7,7),(8,8),(9,9),(10,10);
insert into t_s(c1,c2) values(1,1),(2,2),(3,3),(4,4),(5,5),(6,6),(7,7),(8,8),(9,9),(10,10);
call dbms_stats.gather_table_stats('test','t_p');
call dbms_stats.gather_table_stats('test','t_s');
delete /*+use_px,parallel(10)*/ t_s,t_p from t_s,t_p;
select /*+blocking('all')*/ * from t_p order by c1;
+----+------+------+
| c1 | c2   | c3   |
+----+------+------+
+----+------+------+
select /*+blocking('all')*/ * from t_s order by c1;
+----+------+------+
| c1 | c2   | c3   |
+----+------+------+
+----+------+------+

insert into t_p(c1,c2) values(1,1),(2,2),(3,3),(4,4),(5,5),(6,6),(7,7),(8,8),(9,9),(10,10);
insert into t_s(c1,c2) values(1,1),(2,2),(3,3),(4,4),(5,5),(6,6),(7,7),(8,8),(9,9),(10,10);
call dbms_stats.gather_table_stats('test','t_p');
call dbms_stats.gather_table_stats('test','t_s');
delete /*+use_px, parallel(10),leading(t_s,t_p),pq_distribute(t_p,none,broadcast)*/ t_s from t_s,t_p where t_p.c1 = t_s.c1;
select /*+blocking('all')*/ * from t_s order by c1;
+----+------+------+
| c1 | c2   | c3   |
+----+------+------+
+----+------+------+
insert into t_s(c1,c2) values(1,1),(2,2),(3,3),(4,4),(5,5),(6,6),(7,7),(8,8),(9,9),(10,10);
call dbms_stats.gather_table_stats('test','t_s');
delete /*+use_px, parallel(10)*/ t_s from t_s,t_p where t_p.c1 = t_s.c1;
select /*+blocking('all')*/ * from t_s order by c1;
+----+------+------+
| c1 | c2   | c3   |
+----+------+------+
+----+------+------+

insert into t_s(c1,c2) values(1,1),(2,2),(3,3),(4,4),(5,5),(6,6),(7,7),(8,8),(9,9),(10,10);
call dbms_stats.gather_table_stats('test','t_s');
call dbms_stats.gather_table_stats('test','t_p');
delete /*+use_px, parallel(10)*/ t_p from t_s,t_p where t_p.c1 = t_s.c1 and t_p.c1 = 1;
select /*+blocking('all')*/ * from t_p order by c1;
+----+------+------+
| c1 | c2   | c3   |
+----+------+------+
|  2 |    2 | NULL |
|  3 |    3 | NULL |
|  4 |    4 | NULL |
|  5 |    5 | NULL |
|  6 |    6 | NULL |
|  7 |    7 | NULL |
|  8 |    8 | NULL |
|  9 |    9 | NULL |
| 10 |   10 | NULL |
+----+------+------+
delete from t_p;
delete from t_s;

insert into t_p(c1,c2) values(1,1),(2,2),(3,3),(4,4),(5,5),(6,6),(7,7),(8,8),(9,9),(10,10);
call dbms_stats.gather_table_stats('test','t_p');
call dbms_stats.gather_table_stats('test','t_s');
delete /*+use_px, parallel(1)*/ t_p from t_p4,t_p where t_p.c1 = t_p4.c2 and t_p4.c2 = 4;
select /*+blocking('all')*/ * from t_p order by c1;
+----+------+------+
| c1 | c2   | c3   |
+----+------+------+
|  1 |    1 | NULL |
|  2 |    2 | NULL |
|  3 |    3 | NULL |
|  5 |    5 | NULL |
|  6 |    6 | NULL |
|  7 |    7 | NULL |
|  8 |    8 | NULL |
|  9 |    9 | NULL |
| 10 |   10 | NULL |
+----+------+------+
delete from t_p;
insert into t_p(c1,c2) values(1,1),(2,2),(3,3),(4,4),(5,5),(6,6),(7,7),(8,8),(9,9),(10,10);
call dbms_stats.gather_table_stats('test','t_p');
call dbms_stats.gather_table_stats('test','t_s');
delete /*+use_px, parallel(10)*/ t_p from t_p4,t_p where t_p.c1 = t_p4.c2 and t_p4.c2 = 4;
select /*+blocking('all')*/ * from t_p order by c1;
+----+------+------+
| c1 | c2   | c3   |
+----+------+------+
|  1 |    1 | NULL |
|  2 |    2 | NULL |
|  3 |    3 | NULL |
|  5 |    5 | NULL |
|  6 |    6 | NULL |
|  7 |    7 | NULL |
|  8 |    8 | NULL |
|  9 |    9 | NULL |
| 10 |   10 | NULL |
+----+------+------+
delete from t_p;
delete from t_p4;

## update测试
insert into t_s(c1,c2) values(1,1),(2,2),(3,3),(4,4),(5,5),(6,6),(7,7),(8,8),(9,9),(10,10);
call dbms_stats.gather_table_stats('test','t_s');
call dbms_stats.gather_table_stats('test','t_p');
update /*+use_px, parallel(10)*/ t_s set t_s.c2 = 20 where t_s.c1 >=5;
select /*+blocking('all')*/ * from t_s order by c1;
+----+------+------+
| c1 | c2   | c3   |
+----+------+------+
|  1 |    1 | NULL |
|  2 |    2 | NULL |
|  3 |    3 | NULL |
|  4 |    4 | NULL |
|  5 |   20 | NULL |
|  6 |   20 | NULL |
|  7 |   20 | NULL |
|  8 |   20 | NULL |
|  9 |   20 | NULL |
| 10 |   20 | NULL |
+----+------+------+
delete from t_s;

insert into t_s(c1,c2) values(1,1),(2,2),(3,3),(4,4),(5,5),(6,6),(7,7),(8,8),(9,9),(10,10);
call dbms_stats.gather_table_stats('test','t_s');
update /*+use_px, parallel(10)*/ t_s set t_s.c1 = 20 where t_s.c2 = 5;
select /*+blocking('all')*/ * from t_s order by c1;
+----+------+------+
| c1 | c2   | c3   |
+----+------+------+
|  1 |    1 | NULL |
|  2 |    2 | NULL |
|  3 |    3 | NULL |
|  4 |    4 | NULL |
|  6 |    6 | NULL |
|  7 |    7 | NULL |
|  8 |    8 | NULL |
|  9 |    9 | NULL |
| 10 |   10 | NULL |
| 20 |    5 | NULL |
+----+------+------+
delete from t_s;

insert into t_p(c1,c2) values(1,1),(2,2),(3,3),(4,4),(5,5),(6,6),(7,7),(8,8),(9,9),(10,10);
call dbms_stats.gather_table_stats('test','t_p');
update /*+use_px, parallel(10)*/ t_p set t_p.c3 = 20 where t_p.c1 >= 5;
select /*+blocking('all')*/ * from t_p order by c1;
+----+------+------+
| c1 | c2   | c3   |
+----+------+------+
|  1 |    1 | NULL |
|  2 |    2 | NULL |
|  3 |    3 | NULL |
|  4 |    4 | NULL |
|  5 |    5 |   20 |
|  6 |    6 |   20 |
|  7 |    7 |   20 |
|  8 |    8 |   20 |
|  9 |    9 |   20 |
| 10 |   10 |   20 |
+----+------+------+
delete from t_p;

insert into t_p(c1,c2) values(1,1),(2,2),(3,3),(4,4),(5,5),(6,6),(7,7),(8,8),(9,9),(10,10);
call dbms_stats.gather_table_stats('test','t_p');
update /*+use_px, parallel(10)*/ t_p set t_p.c1 = 20 where t_p.c1 = 5;
select /*+blocking('all')*/ * from t_p order by c1;
+----+------+------+
| c1 | c2   | c3   |
+----+------+------+
|  1 |    1 | NULL |
|  2 |    2 | NULL |
|  3 |    3 | NULL |
|  4 |    4 | NULL |
|  6 |    6 | NULL |
|  7 |    7 | NULL |
|  8 |    8 | NULL |
|  9 |    9 | NULL |
| 10 |   10 | NULL |
| 20 |    5 | NULL |
+----+------+------+
delete from t_p;

insert into t_p(c1,c2) values(1,1),(2,2),(3,3),(4,4),(5,5),(6,6),(7,7),(8,8),(9,9),(10,10);
call dbms_stats.gather_table_stats('test','t_p');
update /*+use_px, parallel(10)*/ t_p as pp set pp.c3 = 20 where pp.c1 >= 5;
select /*+blocking('all')*/ * from t_p order by c1;
+----+------+------+
| c1 | c2   | c3   |
+----+------+------+
|  1 |    1 | NULL |
|  2 |    2 | NULL |
|  3 |    3 | NULL |
|  4 |    4 | NULL |
|  5 |    5 |   20 |
|  6 |    6 |   20 |
|  7 |    7 |   20 |
|  8 |    8 |   20 |
|  9 |    9 |   20 |
| 10 |   10 |   20 |
+----+------+------+
delete from t_p;

insert into t_no_p(c1,c2) values(1,1),(2,2),(3,3),(4,4),(5,5),(6,6),(7,7),(8,8),(9,9),(10,10);
call dbms_stats.gather_table_stats('test','t_no_p');
update /*+use_px, parallel(10)*/ t_no_p set t_no_p.c1 = 20 where t_no_p.c1 >= 5;
select /*+blocking('all')*/ * from t_no_p order by c2;
+------+------+------+
| c1   | c2   | c3   |
+------+------+------+
|    1 |    1 | NULL |
|    2 |    2 | NULL |
|    3 |    3 | NULL |
|    4 |    4 | NULL |
|   20 |    5 | NULL |
|   20 |    6 | NULL |
|   20 |    7 | NULL |
|   20 |    8 | NULL |
|   20 |    9 | NULL |
|   20 |   10 | NULL |
+------+------+------+
delete from t_no_p;

## insert测试：insert插入的表是local的非分区表/单分区的计划是非multi part，其他都是multi part计划
## insert不会出现GI算子在insert算子头上的计划
insert into t_temp_p(c1,c2) values(1,1),(2,2),(3,3),(4,4),(5,5),(6,6),(7,7),(8,8),(9,9),(10,10);
insert into t_temp_s(c1,c3) values(1,1),(2,2),(3,3),(4,4),(5,5),(6,6),(7,7),(8,8),(9,9),(10,10);
insert into t_temp_p4(c1,c2) values(1,1),(2,2),(3,3),(4,4),(5,5),(6,6),(7,7),(8,8),(9,9),(10,10);
insert into t_temp_p5(c1,c2) values(1,1),(2,2),(3,3),(4,4),(5,5),(6,6),(7,7),(8,8),(9,9),(10,10);

insert /*+use_px*/ into t_s select * from t_temp_s;
select /*+blocking('all')*/ * from t_s order by c1;
+----+------+------+
| c1 | c2   | c3   |
+----+------+------+
|  1 | NULL |    1 |
|  2 | NULL |    2 |
|  3 | NULL |    3 |
|  4 | NULL |    4 |
|  5 | NULL |    5 |
|  6 | NULL |    6 |
|  7 | NULL |    7 |
|  8 | NULL |    8 |
|  9 | NULL |    9 |
| 10 | NULL |   10 |
+----+------+------+
delete from t_s;

call dbms_stats.gather_table_stats('test','t_temp_p');
call dbms_stats.gather_table_stats('test','t_temp_s');
call dbms_stats.gather_table_stats('test','t_temp_p4');
call dbms_stats.gather_table_stats('test','t_temp_p5');
insert /*+use_px,parallel(10)*/ into t_s select * from t_temp_s;
select /*+blocking('all')*/ * from t_s order by c1;
+----+------+------+
| c1 | c2   | c3   |
+----+------+------+
|  1 | NULL |    1 |
|  2 | NULL |    2 |
|  3 | NULL |    3 |
|  4 | NULL |    4 |
|  5 | NULL |    5 |
|  6 | NULL |    6 |
|  7 | NULL |    7 |
|  8 | NULL |    8 |
|  9 | NULL |    9 |
| 10 | NULL |   10 |
+----+------+------+
delete from t_s;

call dbms_stats.gather_table_stats('test','t_temp_p');
call dbms_stats.gather_table_stats('test','t_temp_s');
call dbms_stats.gather_table_stats('test','t_temp_p4');
call dbms_stats.gather_table_stats('test','t_temp_p5');
call dbms_stats.gather_table_stats('test','t_s');
insert /*+use_px,parallel(10)*/ into t_s select * from t_temp_p where t_temp_p.c2 >= 5;
select /*+blocking('all')*/ * from t_s order by c1;
+----+------+------+
| c1 | c2   | c3   |
+----+------+------+
|  5 |    5 | NULL |
|  6 |    6 | NULL |
|  7 |    7 | NULL |
|  8 |    8 | NULL |
|  9 |    9 | NULL |
| 10 |   10 | NULL |
+----+------+------+
delete from t_s;

call dbms_stats.gather_table_stats('test','t_s');
insert /*+use_px,parallel(10)*/ into t_s select t_temp_p.c1,t_temp_p.c2,t_temp_s.c3 from t_temp_p,t_temp_s where t_temp_p.c1 = t_temp_s.c1;
select /*+blocking('all')*/ * from t_s order by c1;
+----+------+------+
| c1 | c2   | c3   |
+----+------+------+
|  1 |    1 |    1 |
|  2 |    2 |    2 |
|  3 |    3 |    3 |
|  4 |    4 |    4 |
|  5 |    5 |    5 |
|  6 |    6 |    6 |
|  7 |    7 |    7 |
|  8 |    8 |    8 |
|  9 |    9 |    9 |
| 10 |   10 |   10 |
+----+------+------+
delete from t_s;

call dbms_stats.gather_table_stats('test','t_p');
insert /*+use_px,parallel(10)*/ into t_p select * from t_temp_s;
select /*+blocking('all')*/ * from t_p order by c1;
+----+------+------+
| c1 | c2   | c3   |
+----+------+------+
|  1 | NULL |    1 |
|  2 | NULL |    2 |
|  3 | NULL |    3 |
|  4 | NULL |    4 |
|  5 | NULL |    5 |
|  6 | NULL |    6 |
|  7 | NULL |    7 |
|  8 | NULL |    8 |
|  9 | NULL |    9 |
| 10 | NULL |   10 |
+----+------+------+
delete from t_p;

call dbms_stats.gather_table_stats('test','t_p');
insert /*+use_px,parallel(10)*/ into t_p select * from t_temp_p;
select /*+blocking('all')*/ * from t_p order by c1;
+----+------+------+
| c1 | c2   | c3   |
+----+------+------+
|  1 |    1 | NULL |
|  2 |    2 | NULL |
|  3 |    3 | NULL |
|  4 |    4 | NULL |
|  5 |    5 | NULL |
|  6 |    6 | NULL |
|  7 |    7 | NULL |
|  8 |    8 | NULL |
|  9 |    9 | NULL |
| 10 |   10 | NULL |
+----+------+------+
delete from t_p;

call dbms_stats.gather_table_stats('test','t_p');
insert /*+use_px, parallel(10)*/ into t_p select t_temp_p.c1,t_temp_p.c2,t_temp_p.c3 from t_temp_p,t_temp_p5 where t_temp_p.c1 = t_temp_p5.c1;
select /*+blocking('all')*/ * from t_p order by c1;
+----+------+------+
| c1 | c2   | c3   |
+----+------+------+
|  1 |    1 | NULL |
|  2 |    2 | NULL |
|  3 |    3 | NULL |
|  4 |    4 | NULL |
|  5 |    5 | NULL |
|  6 |    6 | NULL |
|  7 |    7 | NULL |
|  8 |    8 | NULL |
|  9 |    9 | NULL |
| 10 |   10 | NULL |
+----+------+------+
delete from t_p;

call dbms_stats.gather_table_stats('test','t_p');
insert /*+use_px, parallel(10)*/ into t_p select t_temp_p.c1,t_temp_p.c2,t_temp_p.c3 from t_temp_p,t_temp_p5 where t_temp_p.c1 = t_temp_p5.c1 and t_temp_p.c1 = 3;
select /*+blocking('all')*/ * from t_p order by c1;
+----+------+------+
| c1 | c2   | c3   |
+----+------+------+
|  3 |    3 | NULL |
+----+------+------+
delete from t_p;

call dbms_stats.gather_table_stats('test','t_p');
insert /*+use_px, parallel(10)*/ into t_p select  t_temp_p.c1, t_temp_p.c2, t_temp_p.c3 from t_temp_p, t_temp_p4 where t_temp_p.c1 = t_temp_p4.c1;
select /*+blocking('all')*/ * from t_p order by c1;
+----+------+------+
| c1 | c2   | c3   |
+----+------+------+
|  1 |    1 | NULL |
|  2 |    2 | NULL |
|  3 |    3 | NULL |
|  4 |    4 | NULL |
|  5 |    5 | NULL |
|  6 |    6 | NULL |
|  7 |    7 | NULL |
|  8 |    8 | NULL |
|  9 |    9 | NULL |
| 10 |   10 | NULL |
+----+------+------+
delete from t_p;

call dbms_stats.gather_table_stats('test','t_p');
insert /*+use_px,parallel(10)*/ into t_p select t_temp_p.c1,t_temp_p.c2,t_temp_s.c3 from t_temp_p,t_temp_s where t_temp_p.c1 = t_temp_s.c1;
select /*+blocking('all')*/ * from t_p order by c1;
+----+------+------+
| c1 | c2   | c3   |
+----+------+------+
|  1 |    1 |    1 |
|  2 |    2 |    2 |
|  3 |    3 |    3 |
|  4 |    4 |    4 |
|  5 |    5 |    5 |
|  6 |    6 |    6 |
|  7 |    7 |    7 |
|  8 |    8 |    8 |
|  9 |    9 |    9 |
| 10 |   10 |   10 |
+----+------+------+
delete from t_p;
call dbms_stats.gather_table_stats('test','t_p');

drop table if exists t_s,t_p,t_p4,t_no_p,t_temp_s,t_temp_p,t_temp_p4,t_temp_p5;
